{
  "instance_id": "wi_01HXYZ7N8K2QF8E4G5R3SA9PQ2",
  "provider": "Plaid",
  "widget_type": "financial-link",
  "host": {
    "origin": "https://app.example.com",
    "page_url": "https://app.example.com/onboarding/bank",
    "user_agent": "Mozilla/5.0 (Macintosh; Intel Mac OS X 10_15_7) AppleWebKit/537.36 (KHTML, like Gecko) Chrome/123.0.0.0 Safari/537.36"
  },
  "embed_mode": "popup",
  "session_token": "link-sandbox-abc123-9d4e-4f9a-9c4d-1234567890ab",
  "status": "succeeded",
  "user_ref": "user_8f2c1c7e",
  "created_at": "2026-05-19T15:42:11Z",
  "expires_at": "2026-05-19T16:42:11Z",
  "last_event": {
    "name": "success",
    "timestamp": "2026-05-19T15:43:02Z",
    "payload": {
      "public_token": "public-sandbox-7d3f9e21-4a1c-4e8b-bb38-9f1c2e2a3a4b",
      "institution": {
        "name": "Chase",
        "institution_id": "ins_3"
      },
      "accounts": [
        {
          "id": "acc_9q1r2s3t",
          "mask": "0000",
          "name": "Plaid Checking",
          "subtype": "checking",
          "type": "depository"
        }
      ]
    }
  }
}
